{
  "entryId": "ent_K2mNp4Rs8T",
  "challengeId": "chl_B4t8VvQ7Lk",
  "recipeRef": {
    "source": "user",
    "id": "ur_7Kq2m",
    "revision": 3
  },
  "title": "Egg and scallion tortilla fold",
  "authorDisplayName": "Sam",
  "note": "Crisped the tortilla in the pan first.",
  "createdAt": "2026-10-13T18:20:00Z",
  "state": "visible",
  "voteCount": null
}
